[
  {
    "geo": "AR",
    "resource": "lithium",
    "retrieved_at": "2026-10-02",
    "source": "MOCK",
    "unit": "kt LCE",
    "value": 0.0,
    "year": 1990
  },
  {
    "geo": "AR-K",
    "resource": "lithium",
    "retrieved_at": "2026-10-02",
    "source": "MOCK",
    "unit": "kt LCE",
    "value": 0.0,
    "year": 1990
  },
  {
    "geo": "AR-A",
    "resource": "lithium",
    "retrieved_at": "2026-10-02",
    "source": "MOCK",
    "unit": "kt LCE",
    "value": 0.0,
    "year": 1990
  },
  {
    "geo": "AR-Y",
    "resource": "lithium",
    "retrieved_at": "2026-10-02",
    "source": "MOCK",
    "unit": "kt LCE",
    "value": 0.0,
    "year": 1990
  },
  {
    "geo": "AR",
    "resource": "lithium",
    "retrieved_at": "2026-10-02",
    "source": "MOCK",
    "unit": "kt LCE",
    "value": 0.14,
    "year": 1991
  },
  {
    "geo": "AR-K",
    "resource": "lithium",
    "retrieved_at": "2026-10-02",
    "source": "MOCK",
    "unit": "kt LCE",
    "value": 0.14,
    "year": 1991
  },
  {
    "geo": "AR-A",
    "resource": "lithium",
    "retrieved_at": "2026-10-02",
    "source": "MOCK",
    "unit": "kt LCE",
    "value": 0.0,
    "year": 1991
  },
  {
    "geo": "AR-Y",
    "resource": "lithium",
    "retrieved_at": "2026-10-02",
    "source": "MOCK",
    "unit": "kt LCE",
    "value": 0.0,
    "year": 1991
  },
  {
    "geo": "AR",
    "resource": "lithium",
    "retrieved_at": "2026-10-02",
    "source": "MOCK",
    "unit": "kt LCE",
    "value": 0.29,
    "year": 1992
  },
  {
    "geo": "AR-K",
    "resource": "lithium",
    "retrieved_at": "2026-10-02",
    "source": "MOCK",
    "unit": "kt LCE",
    "value": 0.28,
    "year": 1992
  },
  {
    "geo": "AR-A",
    "resource": "lithium",
    "retrieved_at": "2026-10-02",
    "source": "MOCK",
    "unit": "kt LCE",
    "value": 0.0,
    "year": 1992
  },
  {
    "geo": "AR-Y",
    "resource": "lithium",
    "retrieved_at": "2026-10-02",
    "source": "MOCK",
    "unit": "kt LCE",
    "value": 0.01,
    "year": 1992
  },
  {
    "geo": "AR",
    "resource": "lithium",
    "retrieved_at": "2026-10-02",
    "source": "MOCK",
    "unit": "kt LCE",
    "value": 0.42,
    "year": 1993
  },
  {
    "geo": "AR-K",
    "resource": "lithium",
    "retrieved_at": "2026-10-02",
    "source": "MOCK",
    "unit": "kt LCE",
    "value": 0.39,
    "year": 1993
  },
  {
    "geo": "AR-A",
    "resource": "lithium",
    "retrieved_at": "2026-10-02",
    "source": "MOCK",
    "unit": "kt LCE",
    "value": 0.01,
    "year": 1993
  },
  {
    "geo": "AR-Y",
    "resource": "lithium",
    "retrieved_at": "2026-10-02",
    "source": "MOCK",
    "unit": "kt LCE",
    "value": 0.02,
    "year": 1993
  },
  {
    "geo": "AR",
    "resource": "lithium",
    "retrieved_at": "2026-10-02",
    "source": "MOCK",
    "unit": "kt LCE",
    "value": 0.57,
    "year": 1994
  },
  {
    "geo": "AR-K",
    "resource": "lithium",
    "retrieved_at": "2026-10-02",
    "source": "MOCK",
    "unit": "kt LCE",
    "value": 0.52,
    "year": 1994
  },
  {
    "geo": "AR-A",
    "resource": "lithium",
    "retrieved_at": "2026-10-02",
    "source": "MOCK",
    "unit": "kt LCE",
    "value": 0.02,
    "year": 1994
  },
  {
    "geo": "AR-Y",
    "resource": "lithium",
    "retrieved_at": "2026-10-02",
    "source": "MOCK",
    "unit": "kt LCE",
    "value": 0.03,
    "year": 1994
  },
  {
    "geo": "AR",
    "resource": "lithium",
    "retrieved_at": "2026-10-02",
    "source": "MOCK",
    "unit": "kt LCE",
    "value": 0.75,
    "year": 1995
  },
  {
    "geo": "AR-K",
    "resource": "lithium",
    "retrieved_at": "2026-10-02",
    "source": "MOCK",
    "unit": "kt LCE",
    "value": 0.67,
    "year": 1995
  },
  {
    "geo": "AR-A",
    "resource": "lithium",
    "retrieved_at": "2026-10-02",
    "source": "MOCK",
    "unit": "kt LCE",
    "value": 0.03,
    "year": 1995
  },
  {
    "geo": "AR-Y",
    "resource": "lithium",
    "retrieved_at": "2026-10-02",
    "source": "MOCK",
    "unit": "kt LCE",
    "value": 0.05,
    "year": 1995
  },
  {
    "geo": "AR",
    "resource": "lithium",
    "retrieved_at": "2026-10-02",
    "source": "MOCK",
    "unit": "kt LCE",
    "value": 0.86,
    "year": 1996
  },
  {
    "geo": "AR-K",
    "resource": "lithium",
    "retrieved_at": "2026-10-02",
    "source": "MOCK",
    "unit": "kt LCE",
    "value": 0.75,
    "year": 1996
  },
  {
    "geo": "AR-A",
    "resource": "lithium",
    "retrieved_at": "2026-10-02",
    "source": "MOCK",
    "unit": "kt LCE",
    "value": 0.04,
    "year": 1996
  },
  {
    "geo": "AR-Y",
    "resource": "lithium",
    "retrieved_at": "2026-10-02",
    "source": "MOCK",
    "unit": "kt LCE",
    "value": 0.07,
    "year": 1996
  },
  {
    "geo": "AR",
    "resource": "lithium",
    "retrieved_at": "2026-10-02",
    "source": "MOCK",
    "unit": "kt LCE",
    "value": 1.0,
    "year": 1997
  },
  {
    "geo": "AR-K",
    "resource": "lithium",
    "retrieved_at": "2026-10-02",
    "source": "MOCK",
    "unit": "kt LCE",
    "value": 0.86,
    "year": 1997
  },
  {
    "geo": "AR-A",
    "resource": "lithium",
    "retrieved_at": "2026-10-02",
    "source": "MOCK",
    "unit": "kt LCE",
    "value": 0.05,
    "year": 1997
  },
  {
    "geo": "AR-Y",
    "resource": "lithium",
    "retrieved_at": "2026-10-02",
    "source": "MOCK",
    "unit": "kt LCE",
    "value": 0.09,
    "year": 1997
  },
  {
    "geo": "AR",
    "resource": "lithium",
    "retrieved_at": "2026-10-02",
    "source": "MOCK",
    "unit": "kt LCE",
    "value": 1.19,
    "year": 1998
  },
  {
    "geo": "AR-K",
    "resource": "lithium",
    "retrieved_at": "2026-10-02",
    "source": "MOCK",
    "unit": "kt LCE",
    "value": 1.0,
    "year": 1998
  },
  {
    "geo": "AR-A",
    "resource": "lithium",
    "retrieved_at": "2026-10-02",
    "source": "MOCK",
    "unit": "kt LCE",
    "value": 0.07,
    "year": 1998
  },
  {
    "geo": "AR-Y",
    "resource": "lithium",
    "retrieved_at": "2026-10-02",
    "source": "MOCK",
    "unit": "kt LCE",
    "value": 0.12,
    "year": 1998
  },
  {
    "geo": "AR",
    "resource": "lithium",
    "retrieved_at": "2026-10-02",
    "source": "MOCK",
    "unit": "kt LCE",
    "value": 1.13,
    "year": 1999
  },
  {
    "geo": "AR-K",
    "resource": "lithium",
    "retrieved_at": "2026-10-02",
    "source": "MOCK",
    "unit": "kt LCE",
    "value": 0.93,
    "year": 1999
  },
  {
    "geo": "AR-A",
    "resource": "lithium",
    "retrieved_at": "2026-10-02",
    "source": "MOCK",
    "unit": "kt LCE",
    "value": 0.07,
    "year": 1999
  },
  {
    "geo": "AR-Y",
    "resource": "lithium",
    "retrieved_at": "2026-10-02",
    "source": "MOCK",
    "unit": "kt LCE",
    "value": 0.13,
    "year": 1999
  },
  {
    "geo": "AR",
    "resource": "lithium",
    "retrieved_at": "2026-10-02",
    "source": "MOCK",
    "unit": "kt LCE",
    "value": 1.3,
    "year": 2000
  },
  {
    "geo": "AR-K",
    "resource": "lithium",
    "retrieved_at": "2026-10-02",
    "source": "MOCK",
    "unit": "kt LCE",
    "value": 1.04,
    "year": 2000
  },
  {
    "geo": "AR-A",
    "resource": "lithium",
    "retrieved_at": "2026-10-02",
    "source": "MOCK",
    "unit": "kt LCE",
    "value": 0.09,
    "year": 2000
  },
  {
    "geo": "AR-Y",
    "resource": "lithium",
    "retrieved_at": "2026-10-02",
    "source": "MOCK",
    "unit": "kt LCE",
    "value": 0.17,
    "year": 2000
  },
  {
    "geo": "AR",
    "resource": "lithium",
    "retrieved_at": "2026-10-02",
    "source": "MOCK",
    "unit": "kt LCE",
    "value": 1.4,
    "year": 2001
  },
  {
    "geo": "AR-K",
    "resource": "lithium",
    "retrieved_at": "2026-10-02",
    "source": "MOCK",
    "unit": "kt LCE",
    "value": 1.09,
    "year": 2001
  },
  {
    "geo": "AR-A",
    "resource": "lithium",
    "retrieved_at": "2026-10-02",
    "source": "MOCK",
    "unit": "kt LCE",
    "value": 0.11,
    "year": 2001
  },
  {
    "geo": "AR-Y",
    "resource": "lithium",
    "retrieved_at": "2026-10-02",
    "source": "MOCK",
    "unit": "kt LCE",
    "value": 0.2,
    "year": 2001
  },
  {
    "geo": "AR",
    "resource": "lithium",
    "retrieved_at": "2026-10-02",
    "source": "MOCK",
    "unit": "kt LCE",
    "value": 1.62,
    "year": 2002
  },
  {
    "geo": "AR-K",
    "resource": "lithium",
    "retrieved_at": "2026-10-02",
    "source": "MOCK",
    "unit": "kt LCE",
    "value": 1.23,
    "year": 2002
  },
  {
    "geo": "AR-A",
    "resource": "lithium",
    "retrieved_at": "2026-10-02",
    "source": "MOCK",
    "unit": "kt LCE",
    "value": 0.14,
    "year": 2002
  },
  {
    "geo": "AR-Y",
    "resource": "lithium",
    "retrieved_at": "2026-10-02",
    "source": "MOCK",
    "unit": "kt LCE",
    "value": 0.25,
    "year": 2002
  },
  {
    "geo": "AR",
    "resource": "lithium",
    "retrieved_at": "2026-10-02",
    "source": "MOCK",
    "unit": "kt LCE",
    "value": 1.6,
    "year": 2003
  },
  {
    "geo": "AR-K",
    "resource": "lithium",
    "retrieved_at": "2026-10-02",
    "source": "MOCK",
    "unit": "kt LCE",
    "value": 1.18,
    "year": 2003
  },
  {
    "geo": "AR-A",
    "resource": "lithium",
    "retrieved_at": "2026-10-02",
    "source": "MOCK",
    "unit": "kt LCE",
    "value": 0.15,
    "year": 2003
  },
  {
    "geo": "AR-Y",
    "resource": "lithium",
    "retrieved_at": "2026-10-02",
    "source": "MOCK",
    "unit": "kt LCE",
    "value": 0.27,
    "year": 2003
  },
  {
    "geo": "AR",
    "resource": "lithium",
    "retrieved_at": "2026-10-02",
    "source": "MOCK",
    "unit": "kt LCE",
    "value": 1.79,
    "year": 2004
  },
  {
    "geo": "AR-K",
    "resource": "lithium",
    "retrieved_at": "2026-10-02",
    "source": "MOCK",
    "unit": "kt LCE",
    "value": 1.29,
    "year": 2004
  },
  {
    "geo": "AR-A",
    "resource": "lithium",
    "retrieved_at": "2026-10-02",
    "source": "MOCK",
    "unit": "kt LCE",
    "value": 0.18,
    "year": 2004
  },
  {
    "geo": "AR-Y",
    "resource": "lithium",